candidate_id,name,resume_text,last_active_days,profile_score,applications_count
1,Ali Khan,"Python Django developer 3 years SQL REST API experience",2,95,12
2,Sara Ahmed,"Java Spring developer 5 years MySQL experience",45,60,3
3,Ravi Sharma,"Python Machine Learning engineer pandas numpy 2 years",7,80,8
4,Priya Singh,"Django REST API developer Python PostgreSQL 4 years",1,100,15
5,John Doe,"JavaScript React frontend developer 3 years HTML CSS",120,40,1
6,Ramesh Yadav,"Main Python aur Django ka kaam karta hoon 3 saal se SQL ke saath",3,85,10